{"$schema":"https://json-schema.org/draft/2020-12/schema","$id":"https://thedailyline.bet/schemas/video/v1/video-qc-report.schema.json","title":"VideoQcReport","type":"object","additionalProperties":false,"required":["schema_version","qc_report_id","render_manifest_ref","render_manifest_digest","status","gate_results","validated_at","validator_release","report_digest"],"properties":{"schema_version":{"const":"video-qc-report.v1"},"qc_report_id":{"$ref":"common.schema.json#/$defs/Id"},"render_manifest_ref":{"$ref":"common.schema.json#/$defs/Ref"},"render_manifest_digest":{"$ref":"common.schema.json#/$defs/Digest"},"status":{"enum":["PASS","FAIL","REVIEW_REQUIRED"]},"gate_results":{"type":"array","minItems":1,"items":{"$ref":"#/$defs/GateResult"}},"validated_at":{"$ref":"common.schema.json#/$defs/Timestamp"},"validator_release":{"$ref":"common.schema.json#/$defs/Ref"},"report_digest":{"$ref":"common.schema.json#/$defs/Digest"}},"$defs":{"GateResult":{"type":"object","additionalProperties":false,"required":["gate_class","status","code","message","evidence_refs"],"properties":{"gate_class":{"enum":["contract","fact","asset_rights","asset_integrity","layout","safe_zone","text_overflow","captions","audio","render_probe","duration_profile","disclaimer","metadata","publication_package"]},"status":{"enum":["PASS","FAIL","REVIEW_REQUIRED"]},"code":{"type":"string","minLength":1},"message":{"type":"string"},"evidence_refs":{"$ref":"common.schema.json#/$defs/RefSet"}}}}}
