{"schema_version":"video-qc-report.v1","qc_report_id":"qc.mlb.sf-lad.1a","render_manifest_ref":"render-manifest.mlb.sf-lad.1a","render_manifest_digest":"sha256:f70a860b89c7f45910f3e3850bd6945721037b348ecf2f3bd705d8afb8b0a752","status":"PASS","gate_results":[{"gate_class":"contract","status":"PASS","code":"OK","message":"fixture pass","evidence_refs":[]},{"gate_class":"fact","status":"PASS","code":"OK","message":"fixture pass","evidence_refs":[]},{"gate_class":"asset_rights","status":"PASS","code":"OK","message":"fixture pass","evidence_refs":[]},{"gate_class":"asset_integrity","status":"PASS","code":"OK","message":"fixture pass","evidence_refs":[]},{"gate_class":"layout","status":"PASS","code":"OK","message":"fixture pass","evidence_refs":[]},{"gate_class":"safe_zone","status":"PASS","code":"OK","message":"fixture pass","evidence_refs":[]},{"gate_class":"text_overflow","status":"PASS","code":"OK","message":"fixture pass","evidence_refs":[]},{"gate_class":"captions","status":"PASS","code":"OK","message":"fixture pass","evidence_refs":[]},{"gate_class":"audio","status":"PASS","code":"OK","message":"fixture pass","evidence_refs":[]},{"gate_class":"render_probe","status":"PASS","code":"OK","message":"fixture pass","evidence_refs":[]},{"gate_class":"duration_profile","status":"PASS","code":"OK","message":"fixture pass","evidence_refs":[]},{"gate_class":"disclaimer","status":"PASS","code":"OK","message":"fixture pass","evidence_refs":[]},{"gate_class":"metadata","status":"PASS","code":"OK","message":"fixture pass","evidence_refs":[]},{"gate_class":"publication_package","status":"PASS","code":"OK","message":"fixture pass","evidence_refs":[]}],"validated_at":"2026-09-08T16:13:00Z","validator_release":"dlve-qc@vm0","report_digest":"sha256:cdf02402dd5e79af6390b0758e0fb7a47e46379a96c556b6627240790322b967"}
